id,name,slug,price,originalPrice,images,category,subCategory,description,sizes,colors,tags,inStock,isNew,isFeatured,isBestseller
1,Floral Wrap Dress,floral-wrap-dress,1850,2500,https://res.cloudinary.com/dsjlfrzot/image/upload/v1781743234/fashion-store/products/product-1.jpg|https://res.cloudinary.com/dsjlfrzot/image/upload/v1781743139/fashion-store/products/product-1b.jpg,dresses,,A stunning floral wrap dress perfect for summer outings. Made from lightweight chiffon that drapes beautifully.,"XS,S,M,L,XL","Rose,Navy,Ivory","new,bestseller",TRUE,TRUE,TRUE,TRUE
2,Silk Satin Blouse,silk-satin-blouse,1200,1500,https://res.cloudinary.com/dsjlfrzot/image/upload/v1781743141/fashion-store/products/product-2.jpg,tops,,Luxurious silk satin blouse with a relaxed silhouette. Effortlessly elevates any outfit.,"S,M,L,XL","Champagne,Black,Dusty Pink",bestseller,TRUE,FALSE,TRUE,TRUE
3,High-Waist Tailored Trousers,high-waist-tailored-trousers,1650,,https://res.cloudinary.com/dsjlfrzot/image/upload/v1781743236/fashion-store/products/product-3.jpg,bottoms,,Classic high-waist trousers with a tailored fit. A wardrobe essential for the modern woman.,"XS,S,M,L,XL,XXL","Black,Camel,Grey",new,TRUE,TRUE,TRUE,FALSE
4,Embroidered Kameez Set,embroidered-kameez-set,3200,4000,https://res.cloudinary.com/dsjlfrzot/image/upload/v1781743218/fashion-store/products/product-4.jpg,ethnic,,Elegant embroidered kameez set with intricate threadwork. Perfect for festive occasions.,"S,M,L,XL","Teal,Maroon,Gold","new,sale",TRUE,TRUE,TRUE,FALSE
5,Linen Co-ord Set,linen-coord-set,2100,,https://res.cloudinary.com/dsjlfrzot/image/upload/v1781743148/fashion-store/products/product-5.jpg,casual,,Breathable linen co-ord set — blazer and wide-leg trousers sold together. Effortlessly chic.,"XS,S,M,L","Beige,Sage,White",new,TRUE,TRUE,FALSE,FALSE
6,Ruched Mini Dress,ruched-mini-dress,1450,1800,https://res.cloudinary.com/dsjlfrzot/image/upload/v1781743150/fashion-store/products/product-6.jpg,dresses,,Body-hugging ruched mini dress with a flattering silhouette. Ideal for evenings out.,"XS,S,M,L","Black,Red,Champagne","bestseller,sale",TRUE,FALSE,FALSE,TRUE
7,Formal Blazer,formal-blazer,2800,,https://res.cloudinary.com/dsjlfrzot/image/upload/v1781743153/fashion-store/products/product-7.jpg,formal,,Structured single-button blazer with a polished finish. A power dressing essential.,"S,M,L,XL","Black,White,Navy",,TRUE,FALSE,TRUE,FALSE
8,Pleated Midi Skirt,pleated-midi-skirt,1100,,https://res.cloudinary.com/dsjlfrzot/image/upload/v1781743155/fashion-store/products/product-8.jpg,bottoms,,Flowy pleated midi skirt that moves beautifully. Available in several seasonal shades.,"XS,S,M,L,XL","Dusty Rose,Olive,Black",bestseller,TRUE,FALSE,FALSE,TRUE
